{
  "$schema": "https://json-schema.org/draft/2020-12/schema",
  "$id": "https://the-static-collective.invalid/alex/crucible/specimen.schema.json",
  "title": "ALEX Crucible specimen",
  "type": "object",
  "additionalProperties": false,
  "required": [
    "id",
    "title",
    "constitutional_laws",
    "given",
    "attempt",
    "expected",
    "version"
  ],
  "properties": {
    "id": {"type": "string", "minLength": 1},
    "title": {"type": "string", "minLength": 1},
    "constitutional_laws": {
      "type": "array",
      "minItems": 1,
      "items": {"type": "string", "minLength": 1}
    },
    "given": {"type": "object"},
    "attempt": {"type": "object"},
    "expected": {
      "type": "object",
      "additionalProperties": false,
      "required": [
        "disposition",
        "required_receipt_survivors",
        "forbidden_promotions"
      ],
      "properties": {
        "disposition": {
          "enum": ["ACCEPT", "REFUSE", "UNRESOLVED", "INSUFFICIENT_TO_TEST"]
        },
        "refusal_code": {"type": "string", "minLength": 1},
        "required_receipt_survivors": {
          "type": "array",
          "items": {"type": "string", "minLength": 1}
        },
        "forbidden_promotions": {
          "type": "array",
          "items": {"type": "string", "minLength": 1}
        }
      }
    },
    "notes": {"type": "string"},
    "version": {"type": "integer", "minimum": 1}
  }
}
